asset_id,asset_name_en,asset_name_ko,ticker,exchange,country,asset_type
A_070,United States Oil Fund,USO,USO,NYSEARCA,US,ETF
A_1488,ProShares Short S&P500,프로셰어즈숏S&P500,SH,NYSEARCA,US,ETF
A_1489,ProShares Short QQQ,프로셰어즈숏QQQ,PSQ,NASDAQ,US,ETF
A_1490,ProShares Short 20+ Year Treasury,프로셰어즈숏20년국채,TBF,NYSEARCA,US,ETF
A_1491,iShares TIPS Bond ETF,아이셰어즈TIPS국채ETF,TIP,NYSEARCA,US,ETF
A_1492,Invesco DB US Dollar Index Bullish Fund,인베스코달러인덱스강세펀드,UUP,NYSEARCA,US,ETF
A_1493,iPath Series B S&P 500 VIX Short-Term Futures ETN,아이패스VIX단기선물ETN,VXX,NASDAQ,US,ETF
A_1494,ProShares UltraShort Bitcoin ETF,프로셰어즈울트라숏비트코인,BITI,NYSEARCA,US,ETF
